{
  "$schema": "./tokens.schema.json",
  "name": "OpenMPA workbench",
  "version": "2.1.1",
  "source": {
    "design": "../DESIGN.md",
    "reference": "https://github.com/zai-org/ZCode/blob/3c5b227649371507ddc4eb46ac5133afe6db1cab/DESIGN.md",
    "license": "Apache-2.0"
  },
  "theme": {
    "light": {
      "background": "#f8f8f8",
      "background-alt": "#f3f3f2",
      "header": "#ffffff",
      "panel": "#ffffff",
      "sidebar": "#f0f0f0",
      "surface": "#f6f6f5",
      "surface-hover": "#eeeeec",
      "card": "#ffffff",
      "card-selected": "#e7f1ee",
      "card-border": "#dededb",
      "popover": "#ffffff",
      "popover-border": "#dededb",
      "menu": "#ffffff",
      "menu-hover": "#f0f0f0",
      "input": "#ffffff",
      "input-focused": "#ffffff",
      "input-border": "#dededb",
      "input-border-hover": "#c8c8c3",
      "input-border-focused": "#2f746b",
      "foreground": "#292929",
      "foreground-subtle": "#595959",
      "foreground-subtlest": "#636363",
      "foreground-inverse": "#ffffff",
      "border": "#dededb",
      "border-hover": "#c8c8c3",
      "brand": "#5f8f87",
      "primary": "#2f746b",
      "primary-hover": "#255f58",
      "primary-foreground": "#ffffff",
      "accent": "#e7f1ee",
      "hover": "#eeeeec",
      "selected": "#e7f1ee",
      "link": "#2f746b",
      "focus": "#2f746b",
      "success": "#237a46",
      "success-surface": "#eaf6ef",
      "success-surface-foreground": "#17623a",
      "warning": "#9a5c00",
      "warning-surface": "#fbf2df",
      "warning-surface-foreground": "#744400",
      "destructive": "#b42318",
      "destructive-surface": "#fdf0ee",
      "destructive-surface-foreground": "#8e1c13",
      "progress": "#356ea5",
      "progress-surface": "#edf4fb",
      "progress-surface-foreground": "#2c5d8b",
      "code": "#f4f4f3",
      "selection": "#dcebe7",
      "surface-pressed": "#e4e4e1",
      "primary-pressed": "#1e4f49",
      "success-foreground": "#ffffff",
      "warning-foreground": "#ffffff",
      "destructive-foreground": "#ffffff",
      "progress-foreground": "#ffffff",
      "disabled": "#eeeeec",
      "disabled-foreground": "#737373",
      "tooltip": "#292929",
      "tooltip-foreground": "#ffffff",
      "scrollbar": "#a6a6a1",
      "scrim": "#000000",
      "media-canvas": "#ffffff"
    },
    "dark": {
      "background": "#161616",
      "background-alt": "#1d1d1d",
      "header": "#202020",
      "panel": "#202020",
      "sidebar": "#161616",
      "surface": "#252525",
      "surface-hover": "#30302f",
      "card": "#2b2b2b",
      "card-selected": "#263a36",
      "card-border": "#3a3a3a",
      "popover": "#2b2b2b",
      "popover-border": "#3a3a3a",
      "menu": "#202020",
      "menu-hover": "#303030",
      "input": "#2b2b2b",
      "input-focused": "#30302f",
      "input-border": "#3a3a3a",
      "input-border-hover": "#525252",
      "input-border-focused": "#86b8ad",
      "foreground": "#e5e5e5",
      "foreground-subtle": "#b3b3b3",
      "foreground-subtlest": "#a3a3a3",
      "foreground-inverse": "#10211e",
      "border": "#3a3a3a",
      "border-hover": "#525252",
      "brand": "#86b8ad",
      "primary": "#86b8ad",
      "primary-hover": "#9ac7be",
      "primary-foreground": "#10211e",
      "accent": "#1f3531",
      "hover": "#30302f",
      "selected": "#263a36",
      "link": "#9ac7be",
      "focus": "#86b8ad",
      "success": "#66c28a",
      "success-surface": "#1d3928",
      "success-surface-foreground": "#8bd4a7",
      "warning": "#e6a34a",
      "warning-surface": "#3d2e18",
      "warning-surface-foreground": "#f0bc72",
      "destructive": "#f06a61",
      "destructive-surface": "#422320",
      "destructive-surface-foreground": "#ff9a92",
      "progress": "#74a7d5",
      "progress-surface": "#1e3041",
      "progress-surface-foreground": "#9dc5e7",
      "code": "#242424",
      "selection": "#29443e",
      "surface-pressed": "#3a3a38",
      "primary-pressed": "#aed5cc",
      "success-foreground": "#10211e",
      "warning-foreground": "#241a0d",
      "destructive-foreground": "#260e0b",
      "progress-foreground": "#101e2b",
      "disabled": "#252525",
      "disabled-foreground": "#8c8c8c",
      "tooltip": "#e5e5e5",
      "tooltip-foreground": "#161616",
      "scrollbar": "#696969",
      "scrim": "#000000",
      "media-canvas": "#ffffff"
    }
  },
  "typography": {
    "ui-font-size": "14px",
    "ui-xl": "18px",
    "ui-lg": "16px",
    "ui-base": "14px",
    "ui-caption": "13px",
    "ui-sm": "12px",
    "ui-xs": "10px",
    "mobile-input-safe": "16px",
    "line-heading": "1.3",
    "line-body": "1.55",
    "line-compact": "1.4"
  },
  "space": {
    "1": "4px",
    "2": "8px",
    "3": "12px",
    "4": "16px",
    "5": "24px",
    "6": "32px"
  },
  "radius": {
    "none": "0px",
    "sm": "4px",
    "md": "6px",
    "lg": "8px",
    "xl": "12px",
    "2xl": "16px",
    "full": "999px"
  },
  "control": {
    "xs": "20px",
    "sm": "24px",
    "md": "28px",
    "lg": "32px",
    "input": "36px"
  },
  "motion": {
    "press-duration": "120ms",
    "state-duration": "150ms",
    "overlay-duration": "180ms",
    "spinner-duration": "900ms",
    "ease-out": "cubic-bezier(0.2, 0, 0, 1)"
  },
  "elevation": {
    "overlay": "0 12px 32px rgba(0, 0, 0, 0.14)",
    "attention": "0 16px 42px rgba(0, 0, 0, 0.18)"
  },
  "layout": {
    "rail-width": "48px",
    "sidebar-width": "240px",
    "titlebar-height": "44px",
    "reading-column": "760px",
    "fixture-column": "920px",
    "settings-column": "800px",
    "assistant-skill-list-height": "320px"
  },
  "font": {
    "ui": "-apple-system, BlinkMacSystemFont, \"Segoe UI\", sans-serif",
    "mono": "ui-monospace, SFMono-Regular, Menlo, Monaco, Consolas, \"Liberation Mono\", \"Microsoft YaHei UI\", \"PingFang SC\", monospace"
  },
  "icon": {
    "sm": "14px",
    "md": "16px",
    "lg": "18px",
    "brand": "28px"
  },
  "border": {
    "default": "1px",
    "focus": "2px"
  },
  "layer": {
    "base": 0,
    "sticky": 10,
    "popover": 30,
    "overlay": 50,
    "toast": 70
  },
  "weight": {
    "regular": 400,
    "medium": 500,
    "semibold": 600,
    "bold": 700
  }
}
